Film "Deadpool" pokorio američki box office,../images/vijest1.jpg,Film &quot;Deadpool&quot; je na svom debiju pokorio američki box office zaradivši 135 miliona dolara. Zahvaljujući odličnom debiju u kinima;.? film &quot;Deadpool&quot; je postao najuspješniji od svih koji nose oznaku R;.? što znači da je zabranjen za osobe mlađe od 17 godina...,2016-05-19,17:40:34,
Prvi X-Men Apocalypse trailer,../images/vijest2.jpg,Ako ste gledajući X-Men: Days of Future Past odsjedili iza završnice;.? imali ste priliku vidjeti kraći teaser za idući nastavak koji nosi naziv X-Men: Apocalypse. Špekulacije su od tada potvrđene pa znamo da će se X-Men ekipa u novom filmu boriti protiv Apocalypsea i njegova četiri jahača...,2016-05-19,17:41:13,
Apocalypse Sneak Peek,../images/apocalypse.jpg,Film &quot;Deadpool&quot; je na svom debiju pokorio američki box office zaradivši 135 miliona dolara. Zahvaljujući odličnom debiju u kinima;.? film &quot;Deadpool&quot; je postao najuspješniji od svih koji nose oznaku R;.? što znači da je zabranjen za osobe mlađe od 17 godina...,2016-05-19,17:41:50,
Apocalypse poster #1,../images/apocalypse-1.jpg,Ako ste gledajući X-Men: Days of Future Past odsjedili iza završnice;.? imali ste priliku vidjeti kraći teaser za idući nastavak koji nosi naziv X-Men: Apocalypse. Špekulacije su od tada potvrđene pa znamo da će se X-Men ekipa u novom filmu boriti protiv Apocalypsea i njegova četiri jahača...,2016-05-19,17:42:12,
Behind the scenes slike,../images/behind-the-scenes.jpg,ilm &quot;Deadpool&quot; je na svom debiju pokorio američki box office zaradivši 135 miliona dolara. Zahvaljujući odličnom debiju u kinima;.? film &quot;Deadpool&quot; je postao najuspješniji od svih koji nose oznaku R;.? što znači da je zabranjen za osobe mlađe od 17 godina...,2016-05-19,17:42:41,
Charles and Eric poster,../images/eric-xavier.jpg,Ako ste gledajući X-Men: Days of Future Past odsjedili iza završnice;.? imali ste priliku vidjeti kraći teaser za idući nastavak koji nosi naziv X-Men: Apocalypse. Špekulacije su od tada potvrđene pa znamo da će se X-Men ekipa u novom filmu boriti protiv Apocalypsea i njegova četiri jahača...,2016-05-19,17:43:04,
Prijemni ispit na Xavier's School for Gifted Youngsters,../images/vijest3.jpg,Na osnovu člana 125. Zakona o visokom obrazovanju (&quot;Službene novine Kantona Sarajevo&quot;;.? br. 42/13 - prečišćeni tekst i 13/15);.? člana 95. Statuta Xavier Instituta u New Yorku i tačke III Odluke Vlade o davanju...,2016-05-19,17:43:28,
Biografija: Profesor Charles Francis Xavier,../images/vijest4.jpg,Charles Francis Xavier rođen je u New Yorku;.? oca Brian Xavier i majke;.? cijenjene naučnice u oblasti nuklearne fizike;.? Sharon Xavier. Nakon što je izgubio oca u saobraćajnoj nesreći;.? njegov prijatelj Kurt Marko stupa u brak s Sharon...,2016-05-19,17:43:55,
Trumpocalypse,../images/trumpocalypse.jpg,Na osnovu člana 125. Zakona o visokom obrazovanju (&quot;Službene novine Kantona Sarajevo&quot;;.? br. 42/13 - prečišćeni tekst i 13/15);.? člana 95. Statuta Xavier Instituta u New Yorku i tačke III Odluke Vlade o davanju...,2016-05-19,17:44:16,
Biografija: Wolverine,../images/wolverine.jpg,Charles Francis Xavier rođen je u New Yorku;.? oca Brian Xavier i majke;.? cijenjene naučnice u oblasti nuklearne fizike;.? Sharon Xavier. Nakon što je izgubio oca u saobraćajnoj nesreći;.? njegov prijatelj Kurt Marko stupa u brak s Sharon...,2016-05-19,19:44:39,
X-Men Posteri - Drugi dio,../images/x-men-poster.jpg,Na osnovu člana 125. Zakona o visokom obrazovanju (&quot;Službene novine Kantona Sarajevo&quot;;.? br. 42/13 - prečišćeni tekst i 13/15);.? člana 95. Statuta Xavier Instituta u New Yorku i tačke III Odluke Vlade o davanju...,2016-05-19,19:47:02,
X-Men Posteri - Prvi dio,../images/x-men-poster-2.jpg,Charles Francis Xavier rođen je u New Yorku;.? oca Brian Xavier i majke;.? cijenjene naučnice u oblasti nuklearne fizike;.? Sharon Xavier. Nakon što je izgubio oca u saobraćajnoj nesreći;.? njegov prijatelj Kurt Marko stupa u brak s Sharon...,2016-05-19,19:45:23,
Have you found work on Quora?,https://qph.is.quoracdn.net/main-qimg-d58fba3a2a0a1511ecb76718f2381e71?convert_to_webp=true,Yes. I have received at least 6-7 interview invitations. Apart from that;.? a get a lot of these (almost once every week) :<br/><br/>&quot;We are building a platform that will take the world by storm. It is a million dollar idea. Would you like to get on board ? We are looking for talented individuals like you who can handle the technical aspects. Good money is guaranteed&quot;<br/><br/>Needless to say;.? I don't even bother replying to such messages. I have also noticed a meteoric rise in number of profile views and connection requests on LinkedIn ever since I started writing actively on Quora. I can recall at least 2 very genuine invitation from good startups offering me a role that I think might have suited me.<br/><br/>So yes;.? Quora might actually help you discover exciting career opportunities.<br/><br/>Edit : This answer was written on a positive note. I should add that I didn't accept any invitations. Moreover;.? it was pretty evident from my LinkedIn and Quora profile that I am new grad fresh out of college who is actively seeking job opportunities. I do not think experienced developers will have much advantage from Quora - at least not at the time of writing this answer.,2016-05-20,08:59:41,
Reisu-l-ulema uputio čestitku povodom Vaskrsa,http://www.islamskazajednica.ba/images/0Vijesti/0general/reisu-l-ulema-intervju.jpg,Sarajevo;.? 29. april 2016. (MINA) – Danas je reisu-l-ulema Islamske zajednice u Bosni i Hercegovini Husein ef. Kavazović uputio čestitku povodom nastupajućeg pravoslavnog blagdana Vaskrsa  Episkopu zahumsko-hercegovačkom i primorskom Grigoriju.<br/><br/>„Povodom nastupajućeg blagdana Vaskrsa Vama i vjernicima pravoslavne vjere upućujem iskrene čestitke. Želim da Vam blagdani donose radost i novu nadu u bolje razumijevanje i sretniju budućnost za sve nas“;.? stoji između ostalog u čestitki reisu-l-uleme Kavazovića.,2016-05-20,10:49:20,
Reisu-l-ulema primio dr. Alwi Shihaba i Tan Sri dr. Abdullah Bibn Muhammad Zin,http://www.islamskazajednica.ba/images/0Vijesti/2015-10/05-05-2016-01-reis-prijemi-1.jpg,Tokom ovih prijateljskih susreta bilo je riječi o dosada veoma uspješnoj saradnji sa Indonezijom i Malezijom kao i o mogućnostima unapređenja iste;.? a razgovarano je i o zajedničkim projektima.<br/><br/>Reisu-l-ulema Kavazović se i ovom prilikom zahvalio ovim prijateljskim zemljama iz Jugoistočne Azije i njihovim narodima koji su pružili i pružaju svesrdnu pomoć našem narodu i našoj domovini.,2016-05-20,11:20:03,
Izetbegović: Povezivanje ustrojstva Travnika s Mostarom je taktički potez HDZ-a BiH,http://static.klix.ba/media/images/vijesti/b_160520139.jpg?v=1,&quot;To su dva nepoveziva pitanja. Mislim da je to jedan taktički potez HDZ-a BiH i ne bih rekao da iza njega ozbiljno stoji&quot;;.? kazao je Izetbegović novinarima u Travniku na upit da prokomentariše inicijativu političkih stranaka s hrvatskim predznakom da općina Travnik bude ustrojena kao gradska zajednica;.? po jednakim principima kao i Mostar.<br/><br/>Izetbegović je istaknuo da je Mostar tretiran Daytonskim i Washingtonskim sporazumom;.? te da ima specijalni status;.? s obzirom na to da ima specijalnu prošlost.,2016-05-20,21:54:57,
